{
  "id": "c4d31927-b71f-4f0e-8970-bfc6e65e20b4",
  "lemma": "hakea",
  "pos": "verbi",
  "translation_ru": "искать / подавать заявление",
  "example_fi": "Haen töitä kaupungista.",
  "example_ru": "Я ищу работу в городе.",
  "kind": "word",
  "meta": {
    "word_class_detail": "verbityyppi 1",
    "stems": { "vowel": "hae-", "consonant": null },
    "gradation": "k/-",
    "principal_forms": {
      "preesens_1s": "haen",
      "preesens_3s": "hakee",
      "imperfekti_3s": "haki",
      "nut_partisiippi": "hakenut",
      "passiivi": "haetaan"
    },
    "forms_source": "fst",
    "forms_verified": true,
    "rektio": "hakea + partitiivi",
    "puhekieli": "mä haen",
    "confusable_with": ["hakata"],
    "topics": ["työnhaku"],
    "origin": "error"
  }
}
